{
  "$schema": "http://json-schema.org/draft-07/schema#",
  "$id": "cohort_ledger.schema.json",
  "title": "Canonical Cohort Ledger",
  "description": "One record per cohort code across its full lifecycle, joining historical actuals (completed) with forward projections (in-flight). The cash foundation: total pipeline value = booked revenue (actual starts) + projected revenue (in-flight). Built by ledger/build_ledger.py.",
  "type": "object",
  "required": ["generated_at", "snapshot_date", "revenue_per_start", "cohorts", "totals"],
  "properties": {
    "generated_at": { "type": "string", "description": "UTC ISO-8601 timestamp of the build." },
    "snapshot_date": { "type": "string", "description": "The projection snapshot date the in-flight rows came from (YYYY-MM-DD)." },
    "revenue_per_start": { "type": "integer", "description": "Blended revenue per start; sourced from scripts/views.REVENUE_PER_START." },
    "cohorts": {
      "type": "array",
      "items": {
        "type": "object",
        "required": ["cohort", "program", "position_in_year", "lifecycle"],
        "properties": {
          "cohort": { "type": "string", "description": "Cohort code, the join key, e.g. UDT566, NDT566NC." },
          "program": { "type": "string", "enum": ["UDT", "NDT-Day", "NDT-Night"], "description": "Canonical program label, derived from the cohort code via utils.program_for_cohort." },
          "position_in_year": { "type": "integer", "description": "1-indexed position in the annual cycle (utils.position_for_cohort)." },
          "start_date": { "type": ["string", "null"], "description": "Cohort start date (YYYY-MM-DD) when known." },
          "lifecycle": { "type": "string", "enum": ["completed", "in_flight", "future"], "description": "completed = has actual starts; in_flight = currently enrolling with projections; future = known start date, not yet enrolling." },
          "actual_starts": { "type": ["integer", "null"], "description": "Actual started count (completed only). Authoritative source: projection/completed/cohort_actuals.csv." },
          "total_ever_enrolled": { "type": ["integer", "null"], "description": "Total ever enrolled (completed only)." },
          "currently_enrolled": { "type": ["integer", "null"], "description": "Current enrollment (in-flight only), from the projection snapshot." },
          "proj_low": { "type": ["integer", "null"], "description": "Low projected starts (in-flight only)." },
          "proj_mid": { "type": ["integer", "null"], "description": "Mid projected starts (in-flight only)." },
          "proj_high": { "type": ["integer", "null"], "description": "High projected starts (in-flight only)." },
          "booked_revenue": { "type": ["integer", "null"], "description": "actual_starts * revenue_per_start (completed only)." },
          "projected_revenue_mid": { "type": ["integer", "null"], "description": "proj_mid * revenue_per_start (in-flight only)." },
          "reconciliation": {
            "type": ["object", "null"],
            "description": "Cross-check of completed actuals against the historical summary (summary_*.csv). Present for completed cohorts that also appear in the historical summary.",
            "properties": {
              "v2_starts": { "type": "integer", "description": "Starts per the historical dashboard's summary (Active+Drop+Grad definition)." },
              "matches": { "type": "boolean", "description": "True when v2_starts equals actual_starts (Active-only definition)." }
            }
          }
        }
      }
    },
    "totals": {
      "type": "object",
      "description": "Roll-ups across the ledger — the cash headline seed.",
      "required": ["booked_starts", "booked_revenue", "projected_mid_starts", "projected_mid_revenue", "combined_mid_revenue"],
      "properties": {
        "booked_starts": { "type": "integer", "description": "Sum of actual_starts across completed cohorts." },
        "booked_revenue": { "type": "integer", "description": "Sum of booked_revenue across completed cohorts." },
        "projected_low_starts": { "type": "integer" },
        "projected_mid_starts": { "type": "integer", "description": "Sum of proj_mid across in-flight cohorts." },
        "projected_high_starts": { "type": "integer" },
        "projected_mid_revenue": { "type": "integer", "description": "Sum of projected_revenue_mid across in-flight cohorts." },
        "combined_mid_revenue": { "type": "integer", "description": "booked_revenue + projected_mid_revenue — total pipeline cash, mid case." }
      }
    },
    "reconciliation_warnings": {
      "type": "array",
      "description": "Completed cohorts where the Active-only actuals disagree with the historical summary's Active+Drop+Grad starts. Surfaces the starts-definition fork that step 6 (ingestion dedup) will resolve.",
      "items": {
        "type": "object",
        "properties": {
          "cohort": { "type": "string" },
          "actual_starts": { "type": "integer" },
          "v2_starts": { "type": "integer" },
          "note": { "type": "string" }
        }
      }
    }
  }
}
