{
  "generated_at": "2026-10-21T19:51:33.475707+00:00",
  "snapshot_date": "2026-10-21",
  "revenue_per_start": 25300,
  "cohorts": [
    {
      "cohort": "NDT522",
      "program": "NDT-Day",
      "position_in_year": 1,
      "start_date": null,
      "lifecycle": "completed",
      "actual_starts": 7,
      "total_ever_enrolled": 83,
      "currently_enrolled": null,
      "proj_low": null,
      "proj_mid": null,
      "proj_high": null,
      "booked_revenue": 177100,
      "projected_revenue_mid": null,
      "reconciliation": {
        "v2_starts": 7,
        "matches": true
      }
    },
    {
      "cohort": "NDT522NC",
      "program": "NDT-Night",
      "position_in_year": 1,
      "start_date": null,
      "lifecycle": "completed",
      "actual_starts": 2,
      "total_ever_enrolled": 6,
      "currently_enrolled": null,
      "proj_low": null,
      "proj_mid": null,
      "proj_high": null,
      "booked_revenue": 50600,
      "projected_revenue_mid": null,
      "reconciliation": {
        "v2_starts": 2,
        "matches": true
      }
    },
    {
      "cohort": "UDT522",
      "program": "UDT",
      "position_in_year": 1,
      "start_date": null,
      "lifecycle": "completed",
      "actual_starts": 18,
      "total_ever_enrolled": 119,
      "currently_enrolled": null,
      "proj_low": null,
      "proj_mid": null,
      "proj_high": null,
      "booked_revenue": 455400,
      "projected_revenue_mid": null,
      "reconciliation": {
        "v2_starts": 18,
        "matches": true
      }
    },
    {
      "cohort": "NDT523",
      "program": "NDT-Day",
      "position_in_year": 2,
      "start_date": null,
      "lifecycle": "completed",
      "actual_starts": 14,
      "total_ever_enrolled": 50,
      "currently_enrolled": null,
      "proj_low": null,
      "proj_mid": null,
      "proj_high": null,
      "booked_revenue": 354200,
      "projected_revenue_mid": null,
      "reconciliation": {
        "v2_starts": 14,
        "matches": true
      }
    },
    {
      "cohort": "UDT523",
      "program": "UDT",
      "position_in_year": 2,
      "start_date": null,
      "lifecycle": "completed",
      "actual_starts": 7,
      "total_ever_enrolled": 45,
      "currently_enrolled": null,
      "proj_low": null,
      "proj_mid": null,
      "proj_high": null,
      "booked_revenue": 177100,
      "projected_revenue_mid": null,
      "reconciliation": {
        "v2_starts": 7,
        "matches": true
      }
    },
    {
      "cohort": "NDT524",
      "program": "NDT-Day",
      "position_in_year": 3,
      "start_date": null,
      "lifecycle": "completed",
      "actual_starts": 4,
      "total_ever_enrolled": 61,
      "currently_enrolled": null,
      "proj_low": null,
      "proj_mid": null,
      "proj_high": null,
      "booked_revenue": 101200,
      "projected_revenue_mid": null,
      "reconciliation": {
        "v2_starts": 4,
        "matches": true
      }
    },
    {
      "cohort": "NDT524NC",
      "program": "NDT-Night",
      "position_in_year": 2,
      "start_date": null,
      "lifecycle": "completed",
      "actual_starts": 0,
      "total_ever_enrolled": 9,
      "currently_enrolled": null,
      "proj_low": null,
      "proj_mid": null,
      "proj_high": null,
      "booked_revenue": 0,
      "projected_revenue_mid": null,
      "reconciliation": {
        "v2_starts": 0,
        "matches": true
      }
    },
    {
      "cohort": "UDT524",
      "program": "UDT",
      "position_in_year": 3,
      "start_date": null,
      "lifecycle": "completed",
      "actual_starts": 13,
      "total_ever_enrolled": 109,
      "currently_enrolled": null,
      "proj_low": null,
      "proj_mid": null,
      "proj_high": null,
      "booked_revenue": 328900,
      "projected_revenue_mid": null,
      "reconciliation": {
        "v2_starts": 13,
        "matches": true
      }
    },
    {
      "cohort": "NDT525",
      "program": "NDT-Day",
      "position_in_year": 4,
      "start_date": null,
      "lifecycle": "completed",
      "actual_starts": 2,
      "total_ever_enrolled": 32,
      "currently_enrolled": null,
      "proj_low": null,
      "proj_mid": null,
      "proj_high": null,
      "booked_revenue": 50600,
      "projected_revenue_mid": null,
      "reconciliation": {
        "v2_starts": 2,
        "matches": true
      }
    },
    {
      "cohort": "UDT525",
      "program": "UDT",
      "position_in_year": 4,
      "start_date": null,
      "lifecycle": "completed",
      "actual_starts": 10,
      "total_ever_enrolled": 54,
      "currently_enrolled": null,
      "proj_low": null,
      "proj_mid": null,
      "proj_high": null,
      "booked_revenue": 253000,
      "projected_revenue_mid": null,
      "reconciliation": {
        "v2_starts": 10,
        "matches": true
      }
    },
    {
      "cohort": "NDT526",
      "program": "NDT-Day",
      "position_in_year": 5,
      "start_date": null,
      "lifecycle": "completed",
      "actual_starts": 3,
      "total_ever_enrolled": 68,
      "currently_enrolled": null,
      "proj_low": null,
      "proj_mid": null,
      "proj_high": null,
      "booked_revenue": 75900,
      "projected_revenue_mid": null,
      "reconciliation": {
        "v2_starts": 3,
        "matches": true
      }
    },
    {
      "cohort": "NDT526NC",
      "program": "NDT-Night",
      "position_in_year": 3,
      "start_date": null,
      "lifecycle": "completed",
      "actual_starts": 4,
      "total_ever_enrolled": 16,
      "currently_enrolled": null,
      "proj_low": null,
      "proj_mid": null,
      "proj_high": null,
      "booked_revenue": 101200,
      "projected_revenue_mid": null,
      "reconciliation": {
        "v2_starts": 4,
        "matches": true
      }
    },
    {
      "cohort": "UDT526",
      "program": "UDT",
      "position_in_year": 5,
      "start_date": null,
      "lifecycle": "completed",
      "actual_starts": 9,
      "total_ever_enrolled": 108,
      "currently_enrolled": null,
      "proj_low": null,
      "proj_mid": null,
      "proj_high": null,
      "booked_revenue": 227700,
      "projected_revenue_mid": null,
      "reconciliation": {
        "v2_starts": 9,
        "matches": true
      }
    },
    {
      "cohort": "NDT527",
      "program": "NDT-Day",
      "position_in_year": 6,
      "start_date": null,
      "lifecycle": "completed",
      "actual_starts": 5,
      "total_ever_enrolled": 51,
      "currently_enrolled": null,
      "proj_low": null,
      "proj_mid": null,
      "proj_high": null,
      "booked_revenue": 126500,
      "projected_revenue_mid": null,
      "reconciliation": {
        "v2_starts": 5,
        "matches": true
      }
    },
    {
      "cohort": "UDT527",
      "program": "UDT",
      "position_in_year": 6,
      "start_date": null,
      "lifecycle": "completed",
      "actual_starts": 17,
      "total_ever_enrolled": 75,
      "currently_enrolled": null,
      "proj_low": null,
      "proj_mid": null,
      "proj_high": null,
      "booked_revenue": 430100,
      "projected_revenue_mid": null,
      "reconciliation": {
        "v2_starts": 17,
        "matches": true
      }
    },
    {
      "cohort": "NDT528",
      "program": "NDT-Day",
      "position_in_year": 7,
      "start_date": null,
      "lifecycle": "completed",
      "actual_starts": 8,
      "total_ever_enrolled": 84,
      "currently_enrolled": null,
      "proj_low": null,
      "proj_mid": null,
      "proj_high": null,
      "booked_revenue": 202400,
      "projected_revenue_mid": null,
      "reconciliation": {
        "v2_starts": 8,
        "matches": true
      }
    },
    {
      "cohort": "NDT528NC",
      "program": "NDT-Night",
      "position_in_year": 4,
      "start_date": null,
      "lifecycle": "completed",
      "actual_starts": 6,
      "total_ever_enrolled": 23,
      "currently_enrolled": null,
      "proj_low": null,
      "proj_mid": null,
      "proj_high": null,
      "booked_revenue": 151800,
      "projected_revenue_mid": null,
      "reconciliation": {
        "v2_starts": 6,
        "matches": true
      }
    },
    {
      "cohort": "UDT528",
      "program": "UDT",
      "position_in_year": 7,
      "start_date": null,
      "lifecycle": "completed",
      "actual_starts": 22,
      "total_ever_enrolled": 145,
      "currently_enrolled": null,
      "proj_low": null,
      "proj_mid": null,
      "proj_high": null,
      "booked_revenue": 556600,
      "projected_revenue_mid": null,
      "reconciliation": {
        "v2_starts": 22,
        "matches": true
      }
    },
    {
      "cohort": "NDT529",
      "program": "NDT-Day",
      "position_in_year": 8,
      "start_date": null,
      "lifecycle": "completed",
      "actual_starts": 8,
      "total_ever_enrolled": 41,
      "currently_enrolled": null,
      "proj_low": null,
      "proj_mid": null,
      "proj_high": null,
      "booked_revenue": 202400,
      "projected_revenue_mid": null,
      "reconciliation": {
        "v2_starts": 8,
        "matches": true
      }
    },
    {
      "cohort": "UDT529",
      "program": "UDT",
      "position_in_year": 8,
      "start_date": null,
      "lifecycle": "completed",
      "actual_starts": 23,
      "total_ever_enrolled": 94,
      "currently_enrolled": null,
      "proj_low": null,
      "proj_mid": null,
      "proj_high": null,
      "booked_revenue": 581900,
      "projected_revenue_mid": null,
      "reconciliation": {
        "v2_starts": 23,
        "matches": true
      }
    },
    {
      "cohort": "NDT530",
      "program": "NDT-Day",
      "position_in_year": 9,
      "start_date": null,
      "lifecycle": "completed",
      "actual_starts": 5,
      "total_ever_enrolled": 57,
      "currently_enrolled": null,
      "proj_low": null,
      "proj_mid": null,
      "proj_high": null,
      "booked_revenue": 126500,
      "projected_revenue_mid": null,
      "reconciliation": {
        "v2_starts": 5,